{
  "schemaName": "InferenceBackendRun",
  "schemaVersion": "1.0.0",
  "issuedUtc": "2026-02-08T00:00:00Z",
  "backendId": "example.native",
  "openaiBaseUrl": "http://127.0.0.1:9999/v1",
  "openaiHeaders": {},
  "setActive": true,
  "unitSpec": {
    "schemaName": "RuntimeUnitSpec",
    "schemaVersion": "1.0.0",
    "unitId": "inference.example.native",
    "command": "python",
    "args": ["-m", "http.server", "9999"],
    "cwd": ".",
    "env": {},
    "killTree": true,
    "jobObject": true,
    "resources": {
      "maxMemoryBytes": 0,
      "maxCpuPercent": 0
    },
    "labels": {
      "lane": "background",
      "owner": "aas"
    },
    "extensions": {}
  },
  "timeoutSec": 120,
  "captureLogs": true,
  "dryRun": true,
  "traceId": "trace-example",
  "extensions": {}
}
